{"$schema":"https://json-schema.org/draft/2020-12/schema","properties":{"meta":{"properties":{"incident_date":{"type":"string"},"note":{"type":"string"},"timezone":{"const":"Asia/Shanghai"},"title":{"type":"string"},"updated_at":{"format":"date-time","type":"string"}},"required":["title","updated_at"],"type":"object"},"status":{"additionalProperties":{"properties":{"detail":{"type":"string"},"label":{"type":"string"},"value":{"type":"string"}},"required":["label","value","detail"],"type":"object"},"type":"object"},"updates":{"items":{"properties":{"body":{"type":"string"},"category":{"enum":["官方确认","官方表态","链上数据","分析师推测"],"type":"string"},"source":{"type":"string"},"time":{"format":"date-time","type":"string"},"title":{"type":"string"},"url":{"type":["string","null"]}},"required":["time","title","body","category","source"],"type":"object"},"type":"array"},"watchlist":{"items":{"type":"string"},"type":"array"}},"required":["meta","status","updates","watchlist"],"title":"Binance Hack Tracker updates.json","type":"object"}