{
 "meta": {
  "incident_date": "2026-10-30",
  "note": "时间为北京时间。冻结≠追回返还；冲突数字并列，不擅自选一。分类：官方确认 / 链上数据 / 分析师推测 / 官方表态。",
  "timezone": "Asia/Shanghai",
  "title": "币安被盗事件追踪 · Binance Hack Tracker",
  "updated_at": "2026-10-31T21:17:00+08:00"
 },
 "status": {
  "attacker_btc": {
   "detail": "约 $1.4B；大额 BTC 洗钱渠道有限，短期砸盘概率低",
   "label": "攻击者 BTC",
   "value": "18,270 枚未动"
  },
  "attacker_eth": {
   "detail": "已开始小额试探转移（17,260 枚），尚未确认进入混币器；Chainalysis 18:09 观察到被盗资金出现自动化循环流转洗钱模式；ETH 无发行方、无法冻结",
   "label": "攻击者 ETH",
   "value": "约 48 万枚"
  },
  "attribution": {
   "detail": "TRM Labs、Chainalysis 均以高信心指向朝鲜 TraderTraitor/Lazarus；属情报机构判断，非官方结论",
   "label": "归因",
   "value": "官方未归因"
  },
  "coverage": {
   "detail": "币安官方确认已动用 SAFU；用户资金安全；19:01 更新：已预留逾 $63.4 亿公司资金（$50 亿已为同类代币、余下市场/OTC 补齐，不含约 $30 亿冻结资产），已开始恢复用户资产，最终以公开储备证明验证；何一称年收入足以覆盖、暂不卖 SPCX 股份；10-31 03:33 公告#2：$50 多亿对应代币已到位、即已填回约 80%，剩余正通过市场及 OTC 购买；10-31 11:31 Lookonchain/余烬披露约 1.286 亿枚 ENA（约 $2400 万，约占被盗 2.175 亿枚 ENA 的 59%）存入币安，疑为 OTC 买回进展，但币安与 Ethena 均未确认用途，不直接等同已买回",
   "label": "赔付",
   "value": "SAFU + 公司资金全额承担"
  },
  "deposits": {
   "detail": "官方初调称充提均暂停；何一称充值正常运作",
   "label": "充值",
   "value": "口径不一"
  },
  "frozen": {
   "detail": "Tether >15.67 亿 USDT、Circle 约 8.23 亿 USDC 等；另有 USDT0 约 $618 万、Pundi X 约 $37 万小额冻结，不改变总额口径；Allora 另冻结被盗 ALLO 并正全额归还币安（金额未披露、归还进行中），亦不改变约 $30 亿口径",
   "label": "链上已冻结（官方核实）",
   "value": "约 $3.0B"
  },
  "net_loss": {
   "detail": "四种口径并存：略超 $1B（CZ 转述 0xngmi 估算）/ 约 $2B 缺口（CZ 09:46 自算：逾 $6B -$3B 冻结 -$1B SAFU）/ 最大约 $2.64B（江卓尔推算）/ 约 $3.43B（余烬口径）",
   "label": "净损失",
   "value": "未定案"
  },
  "root_cause": {
   "detail": "官方称攻击者进入服务容器提交未授权提现交易，未发现私钥泄露证据；16:37 更新称调查又发现“更多入侵点”，不再只有笔记本一个入口，仍在配合执法部门核实事实，与链上 EIP-7702 授权如何衔接，待技术复盘；22:34 Teng 补充：攻击者用了自毁机制销毁工具与痕迹，EIP-7702 委托未经过正常审批控制",
   "label": "根因（初步）",
   "value": "DevOps 笔记本 + 更多入侵点"
  },
  "total_impact": {
   "detail": "多链毛流出各家口径 $5.5B–$6.36B",
   "label": "总影响（币安官方口径）",
   "value": "约 $6.3B"
  },
  "withdrawals": {
   "detail": "何一称 48 小时内开始逐步恢复（约 11-01 中午起）；16:37 币安更新称仍按计划、45 小时内恢复（约 11-01 下午），与 48 小时口径基本一致；22:34 Teng 新目标：40 小时内恢复（赶在周日截止前）、周一发布完整储备证明（先给初步快照）；主账号已确认 48 小时口径；10-31 03:33 公告#2 细化：约 34 小时内按代币分阶段恢复（约指向 11-01 下午，须通过安全检查、非已恢复），12 小时内首次储备证明快照、结果 11-02 前公布，约 48 小时内公布进一步技术调查结果",
   "label": "提现",
   "value": "暂停中"
  }
 },
 "updates": [
  {
   "time": "2026-10-31T20:39:00+08:00",
   "title": "Chainalysis 新披露 Tron 洗钱路径：稳定币经 DeFi 存款凭证绕冻结、再跨链换 ETH",
   "body": "Chainalysis 于北京时间 10-31 20:39（12:39 UTC）发文（经 ChainCatcher 转述）：币安被盗资金相关地址正试图赶在稳定币冻结前转移资产，其正在追踪的一种方式是——先在波场链上把 TRX 换成稳定币，再存入 DeFi 借贷协议换取存托凭证类代币（凭证代币本身不能被发行方冻结，但可兑换回所代表的稳定币），随后转入未被关联的新钱包换回稳定币，再经跨链桥换成以太坊上的 ETH。关键限定：该方法自约 64 亿美元攻击发生后的早期起即已出现在波场链上，本次是 Chainalysis 10-31 的公开路径披露，不是今天新发生的一笔定额转移——文中未给出这条路径对应的币安资金金额与地址，文中所举 TraderTraitor 转移 50 万美元的例子是该组织在其他案件中的类似手法，不是本案金额；Chainalysis 同时称 Circle 与 Tether 迄今已参与冻结约 28 亿美元（与币安核实约 30 亿美元为统计时点与口径差异，不构成新增冻结），并称把稳定币换成 ETH 并不能使攻击者免于追踪、其调查人员正实时监测相关链上模式。这与 10-30 18:09 已报的自动化拆分—回流—再分发模式同属洗钱环节的不同侧面：此前报的是拆分形态，本次补的是绕冻结的具体机制。大局未变：18,270 枚 BTC 仍未动，ETH 仍无确认进入 Tornado Cash 等混币器的后续，冻结总额仍约 30 亿美元，提现仍按公告#2 的约 34 小时分阶段口径（约 11-01 下午）、尚未恢复，PoR 快照结果仍待 11-02 前公布；因本条是路径披露而非离散新转移，funds.json 的首页 alert 保持 10-31 09:27 的 TRX 池拆分动静记录不变。",
   "category": "链上数据",
   "source": "Chainalysis（经 ChainCatcher 转述）",
   "url": "https://www.chaincatcher.com/article/2300660"
  },
  {
   "time": "2026-10-31T11:31:00+08:00",
   "title": "Ethena 约 1.286 亿枚 ENA 存入币安，疑为买回被盗 ENA 的 OTC 进展（用途未确认）",
   "body": "Lookonchain 于北京时间 10-31 11:31 发帖（经 CryptoTimes / TokenPost / Coinfomania 转述；余烬 @EmberCN 更早于约 08:21 前后窗口已先行提示同一笔转账）：一个被识别为 Ethena 的钱包在约 8 小时内向币安存入约 1.2863 亿枚 ENA（约 $2400 万），约占攻击者 10-29 盗走的 2.175 亿枚 ENA 的 59%，剩余约 8887 万枚 ENA 仍待补齐。关键限定：转账本身是链上事实，但币安与 Ethena 均未确认这笔存入就是买回被盗资产的 OTC 交易——项目方钱包向交易所转账也可能用于做市、财库管理或 OTC 结算，不能直接报成“币安已买回 59% 的 ENA”；攻击者此前已把全部 2.175 亿枚 ENA 以约 $3393 万抛售换 ETH（属已报的 7 种山寨币共 $1.58 亿换 70480 ETH 的一部分），这笔存入与攻击者资金无关、不是攻击者动向，故不触发 funds.json 的资金动静提醒。这是公告#2“剩余部分正通过市场及 OTC 购买”之后，首个代币级别的买回进展链上证据：何一 10-30 已称将按被盗数量原币种全额买回山寨币备更新版 PoR；最终 ENA 是否回到足额储备，仍以 11-02 前公布的首次 PoR 快照结果为准。冻结总额仍约 $30 亿，提现仍按公告#2 的约 34 小时分阶段口径（约 11-01 下午）、尚未恢复，18,270 枚 BTC 仍未动，ETH 仍无确认进入混币器的后续。",
   "category": "链上数据",
   "source": "Lookonchain / @EmberCN（经 CryptoTimes / TokenPost / Coinfomania）",
   "url": "https://www.cryptotimes.io/2026/10/31/binance-buys-back-stolen-assets-via-otc-deals-after-6-3b-hack-as-ethena-sends-24m/"
  },
  {
   "time": "2026-10-31T09:27:00+08:00",
   "title": "黑客 Tron 池拆分：约 6.382 亿 TRX 分 5 址，其中 1.2 亿枚 TRX 再转手",
   "body": "Onchain Lens 监测、Whale Alert 亦报（经 PANews / ChainCatcher / TokenPost / CryptoBriefing 于 10-31 早间披露）：攻击者 Tron 资金池出现新一轮自动化拆分转手。链上时间实为 10-30 18:15–18:20（北京时间）：约 6.382 亿枚 TRX 池在 5 分钟内分拆为 5 个新地址——4 个各得 1.2 亿枚、1 个得 1.582 亿枚；其中一个 1.2 亿枚接收方于 18:20 随即将全额（约 $3878 万）转手至一个已在追踪链中的地址，随后又进一步分发。关键限定：这不是新增被盗——该池源自攻击者此前用约 $2.34 亿 USDT 经 SunSwap 换得的约 6.38 亿 TRX；TokenPost 明确指出，此次交易未指明地址控制人、也未显示卖出或套现；CryptoBriefing / Whale Alert 口径称转入“未知地址”，与 TokenPost“已在追踪链中”并不冲突（未知身份、但在追踪范围内），均未确认进入交易所或混币器。模式与 10-30 18:09 Chainalysis 已报的自动化拆分—回流—再分发洗钱模式一致。18,270 枚 BTC 仍未动，ETH 仍无确认进入 Tornado Cash 等混币器的后续，冻结总额仍约 $30 亿，提现仍按公告#2 的约 34 小时分阶段口径、尚未恢复。",
   "category": "链上数据",
   "source": "Onchain Lens / Whale Alert（经 PANews / ChainCatcher / TokenPost / CryptoBriefing）",
   "url": "https://www.panewslab.com/zh/articles/01a18f91-463a-75c2-a9b9-7abe5ad30779"
  },
  {
   "body": "币安发布安全事件进展公告#2：已准备逾 $63.4 亿公司资金，其中 $50 多亿等值 USDC、USDT、BTC、ETH、BNB 等对应代币已到位，即已填回约 80% 被盗资金，剩余部分正通过市场及 OTC 渠道购买——这是 10-30 19:01 已报 $63.4 亿拨备（$50 亿已持同类代币）的进度表述，非新增拨备额。链上冻结仍约 $30 亿，现阶段仍未发现钱包私钥泄露证据。时间表首次细化：约 34 小时内按代币分阶段恢复提现（自公告约 03:33 起算，约指向 11-01 下午，仍须通过安全检查、非已恢复）；12 小时内进行首次储备证明快照、结果于 11-02（周一）前公布；约 48 小时内公布进一步技术调查结果。此前 Teng 40 小时目标与何一 42 小时口径同属约 11-01 周末恢复区间，34 小时为更具体的分阶段版本。",
   "category": "官方确认",
   "source": "币安安全事件进展公告#2（经 PANews / CryptoBriefing 转述）",
   "time": "2026-10-31T03:33:00+08:00",
   "title": "币安公告#2：已填回约 80% 被盗资金，约 34 小时内分阶段恢复提现",
   "url": "https://www.panewslab.com/zh/articles/01a18e5f-d62b-74bb-b55c-a2cae7755753"
  },
  {
   "body": "Allora 在 X 发帖称：Allora 网络及 ALLO 代币合约安全，币安以外持有的 ALLO 未受影响；部分存放于币安的 ALLO 在本次被盗事件中被盗，团队发现后已执行 ALLO 代币合约内置的紧急保护机制，攻击者已无法转移、出售或使用这部分 ALLO，被盗 ALLO 均未被卖出或转出攻击者钱包；目前正将被盗 ALLO 全额归还币安，ALLO 总供应量不变。金额未披露，不改变币安核实约 $30 亿冻结总额口径；归还进行中、尚未确认到账。这是冻结之外又一笔协议方实际追回待归还的资产（此前 Synthetix SNX 约 $155 万为首笔）。",
   "category": "链上数据",
   "source": "Allora @AlloraNetwork（经 PANews 转述）",
   "time": "2026-10-31T00:30:00+08:00",
   "title": "Allora 已冻结被盗 ALLO，正全额归还币安（金额未披露）",
   "url": "https://www.panewslab.com/zh/articles/01a18da5-e5f3-70b4-922e-7eb7c3d18b68"
  },
  {
   "body": "Decrypt 引述 Arkham 数据：北京时间 10-30 23:37–约 00:12（美东时间周五 11:37–12:12），一个被 Arkham 归因为攻击者的 Tron 钱包向 12 个地址转出约 519 万枚 TRX（约 $173 万）。这是 10-30 白天慢雾已报的 TRX 跨链洗钱腿之后的又一次 Tron 链上拆分动向，金额小，不改变大局：18,270 枚 BTC 仍未动，ETH 仍无确认进入 Tornado Cash 等混币器的后续，冻结总额仍约 $30 亿。注意：12 个接收地址的归属与后续去向未披露，是否进入交易所/混币器未确认。",
   "category": "链上数据",
   "source": "Arkham（经 Decrypt）",
   "time": "2026-10-30T23:37:00+08:00",
   "title": "攻击者 Tron 钱包再拆分约 519 万枚 TRX 至 12 个地址",
   "url": "https://decrypt.co/382237/binance-sets-aside-6-34b-to-cover-hack-losses-ceo-says-your-assets-are-safe"
  },
  {
   "body": "币安联合 CEO Richard Teng 发帖称，目标在 40 小时内恢复提现（希望赶在周日截止前恢复），并于下周一发布完整储备证明报告、在此之前先给初步储备快照。Teng 还披露：攻击者作案期间用了“自毁机制”销毁工具与痕迹，加大了调查难度；涉案 EIP-7702 委托“未经过正常审批控制”。注意：40 小时是目标/希望、不是已恢复；与此前 45–48 小时口径相比窗口进一步收紧，实质仍指向约 11-01 周末恢复；周一完整 PoR 时间表为首次明确，11-01 当天是否先出快照待核实。冻结总额仍约 $3B，18,270 BTC 仍未动，ETH 仍无确认入混币器后续。",
   "category": "官方表态",
   "source": "Richard Teng @_RichardTeng（经 Cointelegraph 直播 / The Defiant / Lookonchain 转述）",
   "time": "2026-10-30T22:34:00+08:00",
   "title": "Teng：目标 40 小时内恢复提现、周一发布完整储备证明",
   "url": "https://thedefiant.io/news/hacks/binance-s-teng-targets-sunday-withdrawal-restart-after-hack"
  },
  {
   "body": "Aave 官方 X 更新：因币安事件预防性冻结的 V3、V4 全部市场已解冻，新存款与新借款恢复；冻结期间提款与还款一直正常；Aave 合约未受事件影响、仓位仍超额抵押。持续预防：USDT、USDC、USDT0、POL、WAVAX、sAVAX、XAUT、PAXG、OP 九项资产 LTV 暂维持 0，暂不能作新借款抵押品。此前 LlamaRisk 已提议在分阶段解冻前削减约 $38 亿未用借款额度，防攻击者用剩余代币开大仓位。注意：解冻不等于攻击者资金移动——攻击者 Aave 仓位本身未变（存 6000 万 USDT 抵押、借 19762 WETH，仍超额抵押；何一所称执法解冻后或多追回约 $14M 仍未成事实），18,270 BTC 仍未动，ETH 仍无确认入混币器后续。",
   "category": "链上数据",
   "source": "Aave 官方（经 Cointelegraph 直播 / Blocktempo 转述）",
   "time": "2026-10-30T21:57:00+08:00",
   "title": "Aave 解除 V3/V4 预防性冻结，9 项资产 LTV 暂置 0 防攻击者再抵押",
   "url": "https://www.blocktempo.com/aave-v3-v4-markets-unfrozen-ltv0-binance-incident/"
  },
  {
   "body": "Newton Foundation 发帖称，攻击者疑似误操作，把约 800 万枚 NEWT 及另外 17 种代币（ANIME、ANKR、ARPA、BARD、CELR、DENT、DOLO、FTT、GLM、HIGH、HOT、KNC、LQTY、RARE、RESOLV、SIGN、WOO）直接转入 NEWT 代币合约地址，合计时价约 $350 万（Lookonchain 估约 $332 万，估值时点差异）。该合约不可升级、无所有者/管理员（管理权已于 2025 年在链上放弃），任何人包括基金会都无法取回，代币永久锁死、攻击者也卖不掉，NEWT 合约本身未被黑。这是此前各轮漏报的补报：金额小，不改变约 $30 亿冻结总额与总影响约 $63 亿口径，也不是发行方冻结或追回返还。",
   "category": "链上数据",
   "source": "Newton Foundation（经 PANews / Lookonchain）",
   "time": "2026-10-30T20:58:00+08:00",
   "title": "攻击者误把约 $350 万代币转入 NEWT 合约，永久锁死",
   "url": "https://www.panews.io/articles/01a18cf2-5ea1-7557-aa43-4f36d3c13e92"
  },
  {
   "time": "2026-10-30T20:45:00+08:00",
   "title": "Elliptic 分链统计：11 条链共被盗约 $64.3 亿、已冻结约 $28.4 亿",
   "body": "链上分析公司 Elliptic 按 11 条区块链统计（价格为盗取时点、冻结数为 10-30 12:45 UTC 截点）：总被盗约 $64.3 亿，已冻结约 $28.4 亿。分链看：以太坊约 $37.98 亿、冻结约 64%；比特币约 $14.76 亿、零冻结；Tron 约 $6.27 亿、冻结约 $3.79 亿；XRP Ledger 约 $3 亿、零冻结；Solana 约 $9,700 万、NEAR 约 $5,400 万均零冻结；Arbitrum 约 $3,200 万中冻结约 96%。其总影响口径与 TRM 的约 $63.6 亿接近、为各机构中最高；冻结数略低于币安自称的约 $30 亿，属截点与统计方法差异，并列呈现。",
   "category": "链上数据",
   "source": "Elliptic（经 @giantcutie666 文章引用其图表）",
   "url": "https://x.com/giantcutie666/status/2116305216366657781"
  },
  {
   "body": "Chainalysis 称其调查人员观察到被盗资金出现“前所未见的洗钱模式”：短时间内数千笔交易，疑似攻击者用自动化手段混淆资金轨迹；资金在地址间反复流转，有时回流到此前用过的钱包。The Defiant 同日报道亦称 Chainalysis 报告描述了显示自动化洗钱的交易模式，并将其冻结口径计为约 $28 亿（与币安核实约 $30 亿为时点/口径差异）。这不是已确认进入 Tornado Cash 等混币器的证据：此前 17,260 ETH 试探转移后仍无确认入混币器的后续，18,270 BTC 仍未动。",
   "category": "链上数据",
   "source": "Chainalysis（经 Cointelegraph 直播 / The Defiant）",
   "time": "2026-10-30T18:09:00+08:00",
   "title": "Chainalysis：攻击者疑用自动化手段洗钱，出现前所未见的循环流转模式",